{
  "formatVersion": "1.0.0",
  "itemId": "example.widget.create",
  "state": "removed",
  "since": "1.0.0",
  "deprecated": "2.0.0",
  "removed": "3.0.0",
  "successor": {
    "targetItemId": "example.widget.submit",
    "canonicalEnglish": "Use the widget submission item; the former create item is no longer available."
  }
}
